{
  "schema": "kryprobe.workload-report.v2",
  "session": {
    "session_id": "0123456789abcdef0123456789abcdef",
    "kernel_identity": "7.0.0-38-generic/boot-A"
  },
  "interval": {
    "start_ns": "100",
    "end_ns": "1000",
    "consistency": "quiescent",
    "clock": "monotonic_boot"
  },
  "profile": "api-returns",
  "boundary": "api_return",
  "dictionary": [
    {
      "dict_id": "n0",
      "kh": "7",
      "family": 1,
      "op": 2,
      "result": 0,
      "context": 1,
      "algorithm": "cbc(aes)",
      "driver": "cbc-aes-aesni"
    },
    {
      "dict_id": "n1",
      "kh": "8",
      "family": 1,
      "op": 2,
      "result": 0,
      "context": 0,
      "algorithm": "cbc(aes)",
      "driver": "cbc-aes-aesni"
    }
  ],
  "contexts": [
    {
      "kh": "7",
      "cgroup_id": "0",
      "tgid": 1000,
      "uid": 0,
      "start_ns": "555",
      "execution_kind": "kthread",
      "calls": "30",
      "native_ref": "n0"
    },
    {
      "kh": "8",
      "cgroup_id": "43812",
      "tgid": 1001,
      "uid": 1000,
      "start_ns": "0",
      "execution_kind": "proc",
      "calls": "20",
      "native_ref": "n1"
    }
  ],
  "ledger": {
    "system_total": "60",
    "per_context_sum": "50",
    "unknown": "10",
    "consistency": "quiescent",
    "gap_unreconciled": false,
    "system_saturated": false,
    "per_context_saturated": false,
    "refused_inserts": "10"
  },
  "partition": {
    "matched": "50",
    "nonmatched": "0",
    "unknown_match": "0"
  },
  "selectors": {
    "kind": "none"
  },
  "scope": {
    "capture_scope": "system",
    "report_scope": "unscoped",
    "group_by": "none"
  },
  "metadata": {
    "status": "unavailable",
    "reason": "no_principal"
  },
  "coverage": {
    "capture": "partial",
    "attribution": "unavailable",
    "metadata": "unavailable",
    "correlation": "complete"
  }
}
